{"mappings":[{"classification":"custom_profile","custom_event_type":"urn:synthworld:event:contextual-business-justification-change:1.0","fact_type":"business_justification","semantic_delta":"This is a versioned SynthWorld contextual event, not a standardized CAEP event type.","standardized_caep_event_type":null,"synthetic":true},{"classification":"custom_profile","custom_event_type":"urn:synthworld:event:contextual-case-assignment-change:1.0","fact_type":"case_assignment","semantic_delta":"This is a versioned SynthWorld contextual event, not a standardized CAEP event type.","standardized_caep_event_type":null,"synthetic":true},{"classification":"custom_profile","custom_event_type":"urn:synthworld:event:contextual-device-posture-change:1.0","fact_type":"device_posture","semantic_delta":"This is a versioned SynthWorld contextual event, not a standardized CAEP event type.","standardized_caep_event_type":null,"synthetic":true},{"classification":"custom_profile","custom_event_type":"urn:synthworld:event:contextual-on-call-change:1.0","fact_type":"on_call","semantic_delta":"This is a versioned SynthWorld contextual event, not a standardized CAEP event type.","standardized_caep_event_type":null,"synthetic":true},{"classification":"custom_profile","custom_event_type":"urn:synthworld:event:contextual-risk-signal-change:1.0","fact_type":"risk_signal","semantic_delta":"This is a versioned SynthWorld contextual event, not a standardized CAEP event type.","standardized_caep_event_type":null,"synthetic":true}],"profile_version":"synthworld-contextual-shared-signals-1.0.0","schedule_view_version":"1.0.0","schema_version":"1.0.0","selected_temporal_base":"synthworld-temporal-1.2.0","synthetic":true}
